[
{"id":"GM05-M01","match_id":"GM05","t_start":146.2,"t_end":181.1,"kind":"goal","importance":0.5609,"wp_before":{"home":0.9132,"draw":0.0557,"away":0.0311},"wp_after":{"home":0.9863,"draw":0.0125,"away":0.0012},"evidence":[{"id":"GM05-M01.e1","label":"Shooter","value":"Cyril Penbrook","unit":null,"event_ids":["GM05-E00042"]},{"id":"GM05-M01.e2","label":"Team","value":"Northbridge United","unit":null,"event_ids":["GM05-E00042"]},{"id":"GM05-M01.e3","label":"Shot xG","value":0.1373,"unit":"xG","event_ids":["GM05-E00042"]},{"id":"GM05-M01.e4","label":"Shot outcome","value":"goal","unit":null,"event_ids":["GM05-E00042"]},{"id":"GM05-M01.e5","label":"Set piece","value":"no","unit":null,"event_ids":["GM05-E00042"]},{"id":"GM05-M01.e6","label":"Actions in the move","value":7.0,"unit":null,"event_ids":["GM05-E00035","GM05-E00036","GM05-E00038","GM05-E00039","GM05-E00040","GM05-E00041","GM05-E00042"]},{"id":"GM05-M01.e7","label":"Score after goal","value":"1-0","unit":null,"event_ids":["GM05-E00043"]},{"id":"GM05-M01.e8","label":"Minute","value":2.0,"unit":null,"event_ids":[]},{"id":"GM05-M01.e9","label":"Win probability change for Northbridge United","value":7.3,"unit":"pp","event_ids":[]}],"counterfactuals":[]},
{"id":"GM05-M02","match_id":"GM05","t_start":1623.7,"t_end":1861.7,"kind":"momentum_shift","importance":0.3669,"wp_before":{"home":0.9871,"draw":0.0116,"away":0.0013},"wp_after":{"home":0.9698,"draw":0.029,"away":0.0012},"evidence":[{"id":"GM05-M02.e1","label":"Team taking control","value":"Northbridge United","unit":null,"event_ids":[]},{"id":"GM05-M02.e2","label":"Momentum at start","value":-0.0864,"unit":"index -1..1 (home +)","event_ids":[]},{"id":"GM05-M02.e3","label":"Momentum at peak","value":0.9011,"unit":"index -1..1 (home +)","event_ids":[]},{"id":"GM05-M02.e4","label":"Swing duration","value":4.0,"unit":"min","event_ids":[]},{"id":"GM05-M02.e5","label":"Minute","value":27.0,"unit":null,"event_ids":[]},{"id":"GM05-M02.e6","label":"Win probability change for Northbridge United","value":-1.7,"unit":"pp","event_ids":[]}],"counterfactuals":[]},
{"id":"GM05-M03","match_id":"GM05","t_start":1960.4,"t_end":1988.4,"kind":"big_chance","importance":0.2764,"wp_before":{"home":0.9698,"draw":0.029,"away":0.0012},"wp_after":{"home":0.9854,"draw":0.0134,"away":0.0011},"evidence":[{"id":"GM05-M03.e1","label":"Shooter","value":"Caio Ferrmere","unit":null,"event_ids":["GM05-E00465"]},{"id":"GM05-M03.e2","label":"Team","value":"Northbridge United","unit":null,"event_ids":["GM05-E00465"]},{"id":"GM05-M03.e3","label":"Shot xG","value":0.3172,"unit":"xG","event_ids":["GM05-E00465"]},{"id":"GM05-M03.e4","label":"Shot outcome","value":"blocked","unit":null,"event_ids":["GM05-E00465"]},{"id":"GM05-M03.e5","label":"Set piece","value":"no","unit":null,"event_ids":["GM05-E00465"]},{"id":"GM05-M03.e6","label":"Actions in the move","value":7.0,"unit":null,"event_ids":["GM05-E00459","GM05-E00460","GM05-E00461","GM05-E00462","GM05-E00463","GM05-E00464","GM05-E00465"]},{"id":"GM05-M03.e7","label":"Minute","value":32.0,"unit":null,"event_ids":[]},{"id":"GM05-M03.e8","label":"Win probability change for Northbridge United","value":1.6,"unit":"pp","event_ids":[]}],"counterfactuals":[]},
{"id":"GM05-M04","match_id":"GM05","t_start":2700.0,"t_end":3319.3,"kind":"momentum_shift","importance":0.3315,"wp_before":{"home":0.99,"draw":0.009,"away":0.001},"wp_after":{"home":0.998,"draw":0.0018,"away":0.0002},"evidence":[{"id":"GM05-M04.e1","label":"Team taking control","value":"Northbridge United","unit":null,"event_ids":[]},{"id":"GM05-M04.e2","label":"Momentum at start","value":0.0935,"unit":"index -1..1 (home +)","event_ids":[]},{"id":"GM05-M04.e3","label":"Momentum at peak","value":0.982,"unit":"index -1..1 (home +)","event_ids":[]},{"id":"GM05-M04.e4","label":"Swing duration","value":7.0,"unit":"min","event_ids":[]},{"id":"GM05-M04.e5","label":"Minute","value":45.0,"unit":null,"event_ids":[]},{"id":"GM05-M04.e6","label":"Win probability change for Northbridge United","value":0.8,"unit":"pp","event_ids":[]}],"counterfactuals":[]},
{"id":"GM05-M05","match_id":"GM05","t_start":2975.1,"t_end":2996.9,"kind":"goal","importance":0.5082,"wp_before":{"home":0.9854,"draw":0.0121,"away":0.0025},"wp_after":{"home":0.9952,"draw":0.0039,"away":0.0009},"evidence":[{"id":"GM05-M05.e1","label":"Shooter","value":"Teo Morholt","unit":null,"event_ids":["GM05-E00730"]},{"id":"GM05-M05.e2","label":"Team","value":"Northbridge United","unit":null,"event_ids":["GM05-E00730"]},{"id":"GM05-M05.e3","label":"Shot xG","value":0.1224,"unit":"xG","event_ids":["GM05-E00730"]},{"id":"GM05-M05.e4","label":"Shot outcome","value":"goal","unit":null,"event_ids":["GM05-E00730"]},{"id":"GM05-M05.e5","label":"Set piece","value":"yes","unit":null,"event_ids":["GM05-E00730"]},{"id":"GM05-M05.e6","label":"Actions in the move","value":4.0,"unit":null,"event_ids":["GM05-E00727","GM05-E00728","GM05-E00729","GM05-E00730"]},{"id":"GM05-M05.e7","label":"Score after goal","value":"2-0","unit":null,"event_ids":["GM05-E00731"]},{"id":"GM05-M05.e8","label":"Minute","value":46.0,"unit":null,"event_ids":[]},{"id":"GM05-M05.e9","label":"Win probability change for Northbridge United","value":1.0,"unit":"pp","event_ids":[]}],"counterfactuals":[]},
{"id":"GM05-M06","match_id":"GM05","t_start":3358.7,"t_end":3380.3,"kind":"big_chance","importance":0.2995,"wp_before":{"home":0.9952,"draw":0.0039,"away":0.0009},"wp_after":{"home":0.998,"draw":0.0018,"away":0.0002},"evidence":[{"id":"GM05-M06.e1","label":"Shooter","value":"Cyril Penbrook","unit":null,"event_ids":["GM05-E00813"]},{"id":"GM05-M06.e2","label":"Team","value":"Northbridge United","unit":null,"event_ids":["GM05-E00813"]},{"id":"GM05-M06.e3","label":"Shot xG","value":0.4859,"unit":"xG","event_ids":["GM05-E00813"]},{"id":"GM05-M06.e4","label":"Shot outcome","value":"post","unit":null,"event_ids":["GM05-E00813"]},{"id":"GM05-M06.e5","label":"Set piece","value":"no","unit":null,"event_ids":["GM05-E00813"]},{"id":"GM05-M06.e6","label":"Actions in the move","value":8.0,"unit":null,"event_ids":["GM05-E00806","GM05-E00807","GM05-E00808","GM05-E00809","GM05-E00810","GM05-E00811","GM05-E00812","GM05-E00813"]},{"id":"GM05-M06.e7","label":"Minute","value":52.0,"unit":null,"event_ids":[]},{"id":"GM05-M06.e8","label":"Win probability change for Northbridge United","value":0.3,"unit":"pp","event_ids":[]}],"counterfactuals":[]},
{"id":"GM05-M07","match_id":"GM05","t_start":3769.2,"t_end":3796.7,"kind":"goal","importance":0.5016,"wp_before":{"home":0.998,"draw":0.0018,"away":0.0001},"wp_after":{"home":0.9999,"draw":0.0,"away":0.0},"evidence":[{"id":"GM05-M07.e1","label":"Shooter","value":"Caio Ferrmere","unit":null,"event_ids":["GM05-E00906"]},{"id":"GM05-M07.e2","label":"Team","value":"Northbridge United","unit":null,"event_ids":["GM05-E00906"]},{"id":"GM05-M07.e3","label":"Shot xG","value":0.1091,"unit":"xG","event_ids":["GM05-E00906"]},{"id":"GM05-M07.e4","label":"Shot outcome","value":"goal","unit":null,"event_ids":["GM05-E00906"]},{"id":"GM05-M07.e5","label":"Set piece","value":"no","unit":null,"event_ids":["GM05-E00906"]},{"id":"GM05-M07.e6","label":"Actions in the move","value":7.0,"unit":null,"event_ids":["GM05-E00900","GM05-E00901","GM05-E00902","GM05-E00903","GM05-E00904","GM05-E00905","GM05-E00906"]},{"id":"GM05-M07.e7","label":"Score after goal","value":"3-0","unit":null,"event_ids":["GM05-E00907"]},{"id":"GM05-M07.e8","label":"Minute","value":59.0,"unit":null,"event_ids":[]},{"id":"GM05-M07.e9","label":"Win probability change for Northbridge United","value":0.2,"unit":"pp","event_ids":[]}],"counterfactuals":[]},
{"id":"GM05-M08","match_id":"GM05","t_start":5480.4,"t_end":5516.0,"kind":"goal","importance":0.6,"wp_before":{"home":1.0,"draw":0.0,"away":0.0},"wp_after":{"home":1.0,"draw":0.0,"away":0.0},"evidence":[{"id":"GM05-M08.e1","label":"Shooter","value":"Teo Morholt","unit":null,"event_ids":["GM05-E01211"]},{"id":"GM05-M08.e2","label":"Team","value":"Northbridge United","unit":null,"event_ids":["GM05-E01211"]},{"id":"GM05-M08.e3","label":"Shot xG","value":0.2761,"unit":"xG","event_ids":["GM05-E01211"]},{"id":"GM05-M08.e4","label":"Shot outcome","value":"goal","unit":null,"event_ids":["GM05-E01211"]},{"id":"GM05-M08.e5","label":"Set piece","value":"no","unit":null,"event_ids":["GM05-E01211"]},{"id":"GM05-M08.e6","label":"Actions in the move","value":7.0,"unit":null,"event_ids":["GM05-E01205","GM05-E01206","GM05-E01207","GM05-E01208","GM05-E01209","GM05-E01210","GM05-E01211"]},{"id":"GM05-M08.e7","label":"Score after goal","value":"4-0","unit":null,"event_ids":["GM05-E01212"]},{"id":"GM05-M08.e8","label":"Minute","value":88.0,"unit":null,"event_ids":[]},{"id":"GM05-M08.e9","label":"Win probability change for Northbridge United","value":0.0,"unit":"pp","event_ids":[]}],"counterfactuals":[]}
]
