[
{"id":"GM04-M01","match_id":"GM04","t_start":2040.9,"t_end":2474.5,"kind":"momentum_shift","importance":0.4421,"wp_before":{"home":0.4185,"draw":0.3675,"away":0.214},"wp_after":{"home":0.5458,"draw":0.2836,"away":0.1707},"evidence":[{"id":"GM04-M01.e1","label":"Team taking control","value":"Kestrel Town","unit":null,"event_ids":[]},{"id":"GM04-M01.e2","label":"Momentum at start","value":-0.5118,"unit":"index -1..1 (home +)","event_ids":[]},{"id":"GM04-M01.e3","label":"Momentum at peak","value":0.6189,"unit":"index -1..1 (home +)","event_ids":[]},{"id":"GM04-M01.e4","label":"Swing duration","value":7.0,"unit":"min","event_ids":[]},{"id":"GM04-M01.e5","label":"Minute","value":34.0,"unit":null,"event_ids":[]},{"id":"GM04-M01.e6","label":"Win probability change for Kestrel Town","value":12.7,"unit":"pp","event_ids":[]}],"counterfactuals":[]},
{"id":"GM04-M02","match_id":"GM04","t_start":2516.4,"t_end":2530.2,"kind":"goal","importance":0.7358,"wp_before":{"home":0.5458,"draw":0.2836,"away":0.1707},"wp_after":{"home":0.8287,"draw":0.1362,"away":0.0351},"evidence":[{"id":"GM04-M02.e1","label":"Shooter","value":"Wen Morby","unit":null,"event_ids":["GM04-E00681"]},{"id":"GM04-M02.e2","label":"Team","value":"Kestrel Town","unit":null,"event_ids":["GM04-E00681"]},{"id":"GM04-M02.e3","label":"Shot xG","value":0.253,"unit":"xG","event_ids":["GM04-E00681"]},{"id":"GM04-M02.e4","label":"Shot outcome","value":"goal","unit":null,"event_ids":["GM04-E00681"]},{"id":"GM04-M02.e5","label":"Set piece","value":"no","unit":null,"event_ids":["GM04-E00681"]},{"id":"GM04-M02.e6","label":"Actions in the move","value":3.0,"unit":null,"event_ids":["GM04-E00679","GM04-E00680","GM04-E00681"]},{"id":"GM04-M02.e7","label":"Score after goal","value":"1-0","unit":null,"event_ids":["GM04-E00682"]},{"id":"GM04-M02.e8","label":"Minute","value":41.0,"unit":null,"event_ids":[]},{"id":"GM04-M02.e9","label":"Win probability change for Kestrel Town","value":28.3,"unit":"pp","event_ids":[]}],"counterfactuals":[]},
{"id":"GM04-M03","match_id":"GM04","t_start":3579.6,"t_end":4000.5,"kind":"momentum_shift","importance":0.5423,"wp_before":{"home":0.7052,"draw":0.2605,"away":0.0344},"wp_after":{"home":0.8746,"draw":0.109,"away":0.0165},"evidence":[{"id":"GM04-M03.e1","label":"Team taking control","value":"Kestrel Town","unit":null,"event_ids":[]},{"id":"GM04-M03.e2","label":"Momentum at start","value":-0.6812,"unit":"index -1..1 (home +)","event_ids":[]},{"id":"GM04-M03.e3","label":"Momentum at peak","value":0.8512,"unit":"index -1..1 (home +)","event_ids":[]},{"id":"GM04-M03.e4","label":"Swing duration","value":7.0,"unit":"min","event_ids":[]},{"id":"GM04-M03.e5","label":"Minute","value":56.0,"unit":null,"event_ids":[]},{"id":"GM04-M03.e6","label":"Win probability change for Kestrel Town","value":16.9,"unit":"pp","event_ids":[]}],"counterfactuals":[]},
{"id":"GM04-M04","match_id":"GM04","t_start":3839.9,"t_end":4726.1,"kind":"press_collapse","importance":0.6903,"wp_before":{"home":0.8466,"draw":0.1333,"away":0.0201},"wp_after":{"home":0.8877,"draw":0.1008,"away":0.0115},"evidence":[{"id":"GM04-M04.e1","label":"Pressing team","value":"Kestrel Town","unit":null,"event_ids":[]},{"id":"GM04-M04.e2","label":"Pressures per minute, 15 min before","value":2.27,"unit":"per min","event_ids":["GM04-E00706","GM04-E00720","GM04-E00743","GM04-E00745","GM04-E00748","GM04-E00752","GM04-E00755","GM04-E00762","GM04-E00764","GM04-E00778","GM04-E00780","GM04-E00782","GM04-E00801","GM04-E00803","GM04-E00806","GM04-E00815","GM04-E00818","GM04-E00822","GM04-E00826","GM04-E00829","GM04-E00836","GM04-E00842","GM04-E00862","GM04-E00864","GM04-E00871","GM04-E00873","GM04-E00876","GM04-E00906","GM04-E00921","GM04-E00926","GM04-E00928","GM04-E00940","GM04-E00949","GM04-E00951","GM04-E00957","GM04-E00983","GM04-E01005","GM04-E01105","GM04-E01111","GM04-E01115"]},{"id":"GM04-M04.e3","label":"Pressures per minute, 15 min after","value":0.4,"unit":"per min","event_ids":["GM04-E00706","GM04-E00720","GM04-E00743","GM04-E00745","GM04-E00748","GM04-E00752","GM04-E00755","GM04-E00762","GM04-E00764","GM04-E00778","GM04-E00780","GM04-E00782","GM04-E00801","GM04-E00803","GM04-E00806","GM04-E00815","GM04-E00818","GM04-E00822","GM04-E00826","GM04-E00829","GM04-E00836","GM04-E00842","GM04-E00862","GM04-E00864","GM04-E00871","GM04-E00873","GM04-E00876","GM04-E00906","GM04-E00921","GM04-E00926","GM04-E00928","GM04-E00940","GM04-E00949","GM04-E00951","GM04-E00957","GM04-E00983","GM04-E01005","GM04-E01105","GM04-E01111","GM04-E01115"]},{"id":"GM04-M04.e4","label":"PPDA, 15 min before","value":5.6,"unit":null,"event_ids":[]},{"id":"GM04-M04.e5","label":"PPDA, 15 min after","value":7.0,"unit":null,"event_ids":[]},{"id":"GM04-M04.e6","label":"Harbor Athletic threat per minute before","value":0.069,"unit":"xT+xG","event_ids":[]},{"id":"GM04-M04.e7","label":"Harbor Athletic threat per minute after","value":0.051,"unit":"xT+xG","event_ids":[]},{"id":"GM04-M04.e8","label":"Minute","value":60.0,"unit":null,"event_ids":[]},{"id":"GM04-M04.e9","label":"Win probability change for Kestrel Town","value":4.1,"unit":"pp","event_ids":[]}],"counterfactuals":[]},
{"id":"GM04-M05","match_id":"GM04","t_start":3994.3,"t_end":4018.2,"kind":"big_chance","importance":0.2797,"wp_before":{"home":0.8712,"draw":0.116,"away":0.0128},"wp_after":{"home":0.8746,"draw":0.109,"away":0.0165},"evidence":[{"id":"GM04-M05.e1","label":"Shooter","value":"Sami Garmore","unit":null,"event_ids":["GM04-E00991"]},{"id":"GM04-M05.e2","label":"Team","value":"Kestrel Town","unit":null,"event_ids":["GM04-E00991"]},{"id":"GM04-M05.e3","label":"Shot xG","value":0.3694,"unit":"xG","event_ids":["GM04-E00991"]},{"id":"GM04-M05.e4","label":"Shot outcome","value":"off_target","unit":null,"event_ids":["GM04-E00991"]},{"id":"GM04-M05.e5","label":"Set piece","value":"no","unit":null,"event_ids":["GM04-E00991"]},{"id":"GM04-M05.e6","label":"Actions in the move","value":7.0,"unit":null,"event_ids":["GM04-E00985","GM04-E00986","GM04-E00987","GM04-E00988","GM04-E00989","GM04-E00990","GM04-E00991"]},{"id":"GM04-M05.e7","label":"Minute","value":62.0,"unit":null,"event_ids":[]},{"id":"GM04-M05.e8","label":"Win probability change for Kestrel Town","value":0.3,"unit":"pp","event_ids":[]}],"counterfactuals":[]},
{"id":"GM04-M06","match_id":"GM04","t_start":5450.3,"t_end":5466.6,"kind":"goal","importance":1.0,"wp_before":{"home":0.9414,"draw":0.0553,"away":0.0032},"wp_after":{"home":0.1215,"draw":0.7827,"away":0.0958},"evidence":[{"id":"GM04-M06.e1","label":"Shooter","value":"Otto Wynmore","unit":null,"event_ids":["GM04-E01298"]},{"id":"GM04-M06.e2","label":"Team","value":"Harbor Athletic","unit":null,"event_ids":["GM04-E01298"]},{"id":"GM04-M06.e3","label":"Shot xG","value":0.0988,"unit":"xG","event_ids":["GM04-E01298"]},{"id":"GM04-M06.e4","label":"Shot outcome","value":"goal","unit":null,"event_ids":["GM04-E01298"]},{"id":"GM04-M06.e5","label":"Set piece","value":"yes","unit":null,"event_ids":["GM04-E01298"]},{"id":"GM04-M06.e6","label":"Actions in the move","value":2.0,"unit":null,"event_ids":["GM04-E01297","GM04-E01298"]},{"id":"GM04-M06.e7","label":"Score after goal","value":"1-1","unit":null,"event_ids":["GM04-E01299"]},{"id":"GM04-M06.e8","label":"Minute","value":87.0,"unit":null,"event_ids":[]},{"id":"GM04-M06.e9","label":"Win probability change for Harbor Athletic","value":9.3,"unit":"pp","event_ids":[]}],"counterfactuals":[]},
{"id":"GM04-M07","match_id":"GM04","t_start":5721.6,"t_end":5744.6,"kind":"goal","importance":1.0,"wp_before":{"home":0.104,"draw":0.831,"away":0.065},"wp_after":{"home":0.0057,"draw":0.0866,"away":0.9077},"evidence":[{"id":"GM04-M07.e1","label":"Shooter","value":"Emre Brenmere","unit":null,"event_ids":["GM04-E01332"]},{"id":"GM04-M07.e2","label":"Team","value":"Harbor Athletic","unit":null,"event_ids":["GM04-E01332"]},{"id":"GM04-M07.e3","label":"Shot xG","value":0.0197,"unit":"xG","event_ids":["GM04-E01332"]},{"id":"GM04-M07.e4","label":"Shot outcome","value":"goal","unit":null,"event_ids":["GM04-E01332"]},{"id":"GM04-M07.e5","label":"Set piece","value":"yes","unit":null,"event_ids":["GM04-E01332"]},{"id":"GM04-M07.e6","label":"Actions in the move","value":4.0,"unit":null,"event_ids":["GM04-E01329","GM04-E01330","GM04-E01331","GM04-E01332"]},{"id":"GM04-M07.e7","label":"Score after goal","value":"1-2","unit":null,"event_ids":["GM04-E01333"]},{"id":"GM04-M07.e8","label":"Minute","value":91.0,"unit":null,"event_ids":[]},{"id":"GM04-M07.e9","label":"Win probability change for Harbor Athletic","value":84.3,"unit":"pp","event_ids":[]}],"counterfactuals":[]}
]
